[
  {
    "id": "bamako",
    "name": "Bamako",
    "country": "ML",
    "capital": true,
    "governance": 55,
    "development": 45,
    "grievance": 35,
    "population_k": 2200,
    "access": 0.9,
    "resources": ["administration", "trade"],
    "government": "civilian",
    "local_legitimacy": 50,
    "intel_coverage": 0.5,
    "patron_influence": { "mercenary": 5 },
    "presence": {},
    "notes": "Capital and core region of Mali. Collapse rolls for ML fire here (DESIGN §5.3).",
    "sources": ["CFR Global Conflict Tracker — Sahel"]
  },
  {
    "id": "mopti",
    "name": "Mopti / Centre",
    "country": "ML",
    "capital": false,
    "governance": 35,
    "development": 25,
    "grievance": 60,
    "population_k": 2100,
    "access": 0.6,
    "resources": ["agriculture", "livestock"],
    "government": "civilian",
    "local_legitimacy": 40,
    "intel_coverage": 0.3,
    "patron_influence": {},
    "presence": {
      "ansar_al_sahel": { "strength": 25, "entrenchment": 15, "visibility": 40 }
    },
    "notes": "Central Mali: intercommunal grievance plus weak state presence — the historical epicenter of post-2015 expansion.",
    "sources": ["ICG reporting on central Mali"]
  },
  {
    "id": "gao",
    "name": "Gao",
    "country": "ML",
    "capital": false,
    "governance": 25,
    "development": 20,
    "grievance": 70,
    "population_k": 550,
    "access": 0.5,
    "resources": ["trade_routes"],
    "government": "civilian",
    "local_legitimacy": 35,
    "intel_coverage": 0.25,
    "patron_influence": {},
    "presence": {
      "ansar_al_sahel": { "strength": 20, "entrenchment": 10, "visibility": 45 },
      "wilayat_sahel": { "strength": 15, "entrenchment": 5, "visibility": 50 }
    },
    "notes": "Northern hub on the Niger bend; contested between both composites from the start.",
    "sources": ["CFR Global Conflict Tracker — Sahel"]
  },
  {
    "id": "kidal",
    "name": "Kidal",
    "country": "ML",
    "capital": false,
    "governance": 15,
    "development": 15,
    "grievance": 80,
    "population_k": 85,
    "access": 0.3,
    "resources": ["smuggling_economy"],
    "government": "civilian",
    "local_legitimacy": 25,
    "intel_coverage": 0.2,
    "patron_influence": {},
    "presence": {
      "ansar_al_sahel": { "strength": 30, "entrenchment": 25, "visibility": 35 }
    },
    "notes": "Far-north Tuareg heartland; state writ minimal at start date. Highest starting entrenchment on the map.",
    "sources": ["2012 northern Mali collapse record"]
  },
  {
    "id": "ouagadougou",
    "name": "Ouagadougou",
    "country": "BF",
    "capital": true,
    "governance": 50,
    "development": 40,
    "grievance": 40,
    "population_k": 1900,
    "access": 0.85,
    "resources": ["administration", "trade"],
    "government": "civilian",
    "local_legitimacy": 45,
    "intel_coverage": 0.45,
    "patron_influence": { "mercenary": 5 },
    "presence": {},
    "notes": "Capital and core region of Burkina Faso. Collapse rolls for BF fire here.",
    "sources": ["CFR Global Conflict Tracker — Sahel"]
  },
  {
    "id": "tillaberi",
    "name": "Tillabéri",
    "country": "NE",
    "capital": false,
    "governance": 30,
    "development": 20,
    "grievance": 65,
    "population_k": 2700,
    "access": 0.55,
    "resources": ["agriculture"],
    "government": "civilian",
    "local_legitimacy": 35,
    "intel_coverage": 0.3,
    "patron_influence": {},
    "presence": {
      "ansar_al_sahel": { "strength": 10, "entrenchment": 5, "visibility": 40 },
      "wilayat_sahel": { "strength": 20, "entrenchment": 10, "visibility": 55 }
    },
    "notes": "Niger's tri-border region — the most attacked sector of the real arc. Niger's capital is off-map at Sahel-lite scale, so NE cannot collapse in this dataset; full arc map (v0.4) adds Niamey.",
    "sources": ["ACLED tri-border incident data"]
  }
]
